{
  "contract": "MotionCapabilityRegistry.v1",
  "version": "1.1.0",
  "profileDeclarations": {
    "story": "populated",
    "website": "declared_empty",
    "social": "declared_empty"
  },
  "capabilities": [
    {
      "id": "pod-css-keyframes.v1",
      "executor": "pod_css",
      "triggers": ["idle", "scene-enter"],
      "parameterSchemaRef": "harvested-css-keyframes.v1",
      "sourceFragmentPolicy": "side-effect-free-css-only",
      "reducedMotion": "disable",
      "focusPolicy": "not-interactive",
      "roleClassifications": [
        { "target_profile": "story", "role": "enter" },
        { "target_profile": "story", "role": "ambient" }
      ],
      "evidenceRequirements": ["animation-metadata", "computed-style", "reduced-motion"]
    },
    {
      "id": "pod-css-transition.v1",
      "executor": "pod_css",
      "triggers": ["hover", "focus"],
      "parameterSchemaRef": "harvested-css-transition.v1",
      "sourceFragmentPolicy": "side-effect-free-css-only",
      "reducedMotion": "disable",
      "focusPolicy": "preserve",
      "roleClassifications": [
        { "target_profile": "story", "role": "interaction" }
      ],
      "evidenceRequirements": ["computed-style", "target-geometry", "reduced-motion", "focus-state"]
    },
    {
      "id": "story-reveal-on-enter.v1",
      "executor": "storytime",
      "triggers": ["scene-enter"],
      "parameterSchemaRef": "modes/motion.schema.json#/$defs/revealParameters",
      "sourceFragmentPolicy": "none",
      "reducedMotion": "final-state",
      "focusPolicy": "preserve",
      "roleClassifications": [
        { "target_profile": "story", "role": "enter" }
      ],
      "evidenceRequirements": ["animation-metadata", "computed-style", "target-geometry", "reduced-motion", "focus-state"]
    },
    {
      "id": "story-scroll-progress-transform.v1",
      "executor": "storytime",
      "triggers": ["scroll-progress"],
      "parameterSchemaRef": "modes/motion.schema.json#/$defs/scrollTransformParameters",
      "sourceFragmentPolicy": "none",
      "reducedMotion": "final-state",
      "focusPolicy": "not-interactive",
      "roleClassifications": [
        { "target_profile": "story", "role": "progress" }
      ],
      "evidenceRequirements": ["computed-style", "normalized-progress", "target-geometry", "reduced-motion"]
    },
    {
      "id": "story-count-up-on-enter.v1",
      "executor": "storytime",
      "triggers": ["scene-enter"],
      "parameterSchemaRef": "modes/motion.schema.json#/$defs/countUpParameters",
      "sourceFragmentPolicy": "none",
      "reducedMotion": "final-state",
      "focusPolicy": "not-interactive",
      "roleClassifications": [
        { "target_profile": "story", "role": "enter" }
      ],
      "evidenceRequirements": ["computed-style", "animation-metadata", "reduced-motion"]
    },
    {
      "id": "story-progress-reveal.v1",
      "executor": "storytime",
      "triggers": ["scene-enter", "scroll-progress"],
      "parameterSchemaRef": "modes/motion.schema.json#/$defs/progressRevealParameters",
      "sourceFragmentPolicy": "none",
      "reducedMotion": "final-state",
      "focusPolicy": "not-interactive",
      "roleClassifications": [
        { "target_profile": "story", "role": "enter" },
        { "target_profile": "story", "role": "progress" }
      ],
      "evidenceRequirements": ["computed-style", "normalized-progress", "target-geometry", "reduced-motion"]
    }
  ]
}
